user_screen_name,text,created_at
NathalieBoisse7,Je ne me ferai pas vacciner car j'ai un très bon système immunitaire et  je suis libre de choisir ce qui est bon pour moi et mes enfants,Sun Jul 11 01:42:00 +0000 2021
Caviglialauren1,Bonjour Je suis écœuré par vos propos Je ne me ferai pas vacciner car je n'ai aucune confiance en vous en la parole du gouvernement Ce n'est bien sûr pas la raison principale mais c'est celle qui enfonce le clou,Sat Jul 17 15:48:00 +0000 2021
Parisien92aze,Ah mais entièrement d’accord Je ne remets absolument pas en cause l’efficacité du vaccin à court terme les chiffres sont clairs Je ne me ferai pas vacciner car il n’y a en revanche aucune étude sur les effets à long terme et j’ai pas prévu de me faire piquer tous les 6 mois,Fri Jul 30 16:28:00 +0000 2021
freezaw_,Tu est le meilleur perso je ne vais pas me faire vacciner car je n'en ai pas le besoin Mais je constate que notre gouvernement osé toucher au loi des droits de l'homme pour notre détruire notre liberté Enfin je vais avoir 80 000 commentaires toxique à m'insulter en dessus,Tue Jul 13 08:45:00 +0000 2021
johnwooo60,Moi je ne vais pas me faire vacciner car mon corps m'appartient n'appartient pas au gouvernement sur ce bon courage au petit mouton,Tue Jul 13 17:37:00 +0000 2021
le_yann_pi,Je suis contre le vaccin car j’ai peur des aiguilles,Thu Jul 15 09:08:00 +0000 2021
Dedel9177,Pour ma part j’ai bossé sans protection en 03/2020 je n’ai pas attrapé le Microbe ouf Je fais tjs les gestes je ne fais pas la bise j enlace pas mes parents ni amis je nettoie les emballages de courses etc… Et je suis contre le vaccin car pas de recul sur les années à suivre,Wed Jul 21 16:29:00 +0000 2021
