user_screen_name,text
jdcsef,Je me suis fait vacciné car je crois dans la science et j'ai même fait partie d'un test clinique pro deo évidement d'un vaccin non homologué pour prendre ma part et augmenter le panel de solution contre cette épidémie
LeaAssayag,Je me suis vacciné seulement pour partir en vacance c’est tout et parce que les test antigenique font trop mal
agmlscallaert,Je suis vacciné car je crois en la vaccination Certains sont vaccinés pour pouvoir être libre d’aller ou ils veulent D’autre l’a refuse encore Et là on apprend qu’un test neg sera obligatoire en plus du pass vaccinale dans certain lieu Sa sera sans moi cette fois
florent_57,Et pour avoir le pass il faut se faire VACCINER car aucun non vacciné ne pourra payer un test tout les 3 jours pour faire ses courses
Panam_inside,C'est un double voir triple discours on demande aux vaccinés de se faire tester pour pas propager le virus mais on te dis aussi qu'il faut se faire vacciner car sinon on en viendra pas a bout mais le vaccin empêche la propagation ou pas  Et c'est pour protéger qui en fait
anthoneymoon,Après moi je suis pour le vaccin car ça protège des formes graves on peut pas le nier Mais à partir du moment où tu fais des test régulièrement je ne vois pas où est le soucis
